link,tag,description
https://t.co/oV,Invalid URL,"The provided URL appears to be an incomplete or truncated web address. The link 'https://t.co/oV' is too short to be a fully functional URL. It seems to be a partial Twitter shortened link, but lacks the necessary additional characters to represent a complete web destination. Without more context or the full URL, it's not possible to determine its actual content or purpose."
https://x.com/heynina101/status/1985284315282907143?s=51&t=JsTxSwMxTXa9,Social Media Post,"This appears to be a specific social media post on X (formerly Twitter) from user @heynina101. The URL links to a particular tweet with a unique status ID. Without direct access to view the specific content, I can only confirm it is a specific social media post shared on the X platform. The additional parameters (s=51&t=JsTxSwMxTXa9) suggest tracking or reference information related to the link's sharing or viewing context."
https://x.com/clementdelangue/status/1985357572300321213?s=51&t=JsTxSwM,Tech Leadership,"This appears to be a social media post (X/Twitter) by Clement Delangue, likely the CEO of Hugging Face, discussing a technology or professional topic. Without being able to view the specific content directly, the URL suggests a tweet that might relate to AI, machine learning, tech entrepreneurship, or industry insights. The format indicates a specific tweet shared with additional context or commentary, potentially providing professional perspective or commentary on current tech trends or developments."
https://x.com/proftomyeh/status/1985376111782711560?s=51&t=JsTxSwMxTXa9,Social Media Post,"This appears to be a social media post on X (formerly Twitter) by a user with the handle @proftomyeh. The URL links to a specific tweet identified by a unique status ID. Without direct access to view the specific content, I can only confirm it's a link to a social media post, which could potentially contain text, images, or other media shared by the user. The additional URL parameters (s=51&t=JsTxSwMxTXa9) suggest tracking or referral information typically used by social media platforms to monitor link sharing and user engagement."
https://www.linkedin.com/posts/jeromegranon_les-product-managers-perdent-5h-par-semaine-activity-7391025165897322497-m5Xi?utm_medium=ios_app&rcm=ACoAAAAEYYQBAG8XEbAwDEP0PvuiZUVQs5HsO8o&utm_source=social_share_send&utm_campaign=share_via,Product Management Productivity,"This LinkedIn post by Jerome Granon appears to discuss productivity challenges for product managers, specifically highlighting that product managers lose approximately 5 hours per week (likely due to inefficient processes, meetings, or administrative tasks). The post seems to focus on identifying time-wasting activities and potentially offering strategies to improve workflow efficiency in product management roles. The content is in French, suggesting it's targeted at French-speaking product management professionals, and aims to raise awareness about productivity bottlenecks in the field."
"https://www.kompozite.io/blog/le-co2-equivalent-comprendre-limportance-de-lunite-de-mesure-des-ges#:~:text=L'une%20des%20raisons%20pour,des%20si%C3%A8cles%2C%20voire%20des%20mill%C3%A9naires",Climate Change Metrics,"This French-language blog post on Kompozite.io discusses CO2 equivalent (CO2e), a critical measurement unit for greenhouse gas (GHG) emissions. The article aims to help readers understand the importance of this standardized metric in quantifying and comparing different greenhouse gases' environmental impact. CO2 equivalent allows for a unified way of measuring various greenhouse gases by converting them to a common scale based on their global warming potential. This helps scientists, policymakers, and organizations assess and communicate the climate change implications of different emissions, enabling more effective environmental strategies and comparisons across different types of greenhouse gases."
https://x.com/akshay_pachaar/status/1984236460510519631?s=51&t=JsTxSwMx,Social Media Post,"This appears to be a link to a specific tweet (post) on X (formerly Twitter) by a user named Akshay Pachaar. The URL contains a specific tweet status ID, suggesting it's an individual social media message. Without being able to directly view the content, I can only confirm it's a social media post from a specific user's account on the X platform. The 's=51&t=' parameters in the URL suggest this might be a shared or tracked link, potentially from a mobile or specific sharing context."
https://climat.be/changements-climatiques/causes/gaz-a-effet-de-serre,Climate Change Science,"This is a Belgian climate change website page specifically focused on greenhouse gases (gaz à effet de serre), which discusses the scientific understanding of gases that contribute to global warming. The URL suggests the page provides detailed information about the types, sources, and impacts of greenhouse gases in the context of climate change. Likely written in French, the resource appears to be an educational resource explaining the fundamental role of greenhouse gases in driving climate change, potentially covering topics like carbon dioxide, methane, and other atmospheric gases that trap heat and contribute to the greenhouse effect. The website seems to be part of a broader climate information platform aimed at informing the public about the scientific mechanisms underlying global climate transformation."
https://x.com/krupaad/status/1983177325626720748?s=51&t=JsTxSwMxTXa9UPI,Social Media Post,"This is a link to a specific post on X (formerly Twitter) by a user with the handle @krupaad. The post appears to be a tweet shared on the social media platform. Without being able to directly view the content, the URL suggests it's a specific social media update with a unique post ID. The 's=51&t=JsTxSwMxTXa9UPI' parameters likely relate to tracking or sharing information about the specific post or user session."
https://x.com/pontusab/status/1981689626101469601?s=51&t=JsTxSwMxTXa9UP,Social Media Tech Demo,"This appears to be a social media post (likely from X/Twitter) by a user named Pontus sharing a technology or software demonstration. Without direct access to the specific content, the URL suggests a tweet that potentially showcases a coding project, software feature, or technical innovation. The post seems to involve a unique identifier (1981689626101469601) which indicates it's a specific social media update. The additional parameters (s=51&t=JsTxSwMxTXa9UP) suggest tracking or referral information typical of shared links."
http://albertapp.com/,AI Productivity Tool,"Albert is an AI-powered productivity and work management application designed to help professionals and teams streamline their workflows. The platform appears to use artificial intelligence to assist with task organization, collaboration, and potentially automate or optimize various workplace processes. While the specific details aren't fully clear from the URL alone, the app seems to target businesses and individuals looking to enhance their productivity through intelligent digital tools. It likely offers features such as task tracking, project management, smart scheduling, or AI-assisted work coordination. The '.com' domain and professional-sounding name suggest a serious, enterprise-focused software solution aimed at improving workplace efficiency through cutting-edge AI technology."
https://x.com/neatprompts/status/1980129370653257739?s=51&t=JsTxSwMxTXa,AI Prompting,"This appears to be a social media post from X (formerly Twitter) about AI prompts, shared by a user/account called 'neatprompts'. The link likely contains a discussion, example, or tutorial related to crafting effective prompts for AI language models like ChatGPT. Without being able to directly view the content, it seems to be part of the growing community focused on exploring and sharing strategies for optimal AI interaction and prompt engineering."
https://www.linkedin.com/in/ACoAACLFt6gBxTlcN3EdFQQ0P9qUu7ql8N9fMJQ),Professional Profile,"This appears to be a LinkedIn profile URL, which typically contains an individual's professional information, career history, skills, and networking details. The alphanumeric string in the URL suggests it's a unique identifier for a specific LinkedIn user profile. However, without direct access to view the profile, specific details about the individual cannot be determined. LinkedIn profiles generally showcase a person's professional background, including current and past work experiences, educational qualifications, professional accomplishments, and networking connections."
https://x.com/karpathy/status/1980397031542989305?s=51&t=JsTxSwMxTXa9UP,AI/Tech Commentary,"This appears to be a tweet by Andrej Karpathy, a prominent AI researcher and former director of AI at Tesla, shared on X (formerly Twitter). Given Karpathy's expertise, the tweet likely contains insights, commentary, or discussion about artificial intelligence, machine learning, programming, or technology trends. Without being able to view the specific content, the URL suggests it's a social media post from a respected figure in the AI community who often shares technical perspectives, code snippets, or analytical thoughts about AI development and research."
https://www.linkedin.com/posts/nelson-uzenabor-08a86aa0_anthropic-just-broke-the-rules-they-activity-7380557390355595264-05yI?utm_medium=ios_app&rcm=ACoAAAAEYYQBAG8XEbAwDEP0PvuiZUVQs5HsO8o&utm_source=social_share_send&utm_campaign=share_via,AI/Technology Discourse,"This appears to be a LinkedIn post discussing Anthropic, an AI company, potentially related to some controversial action or statement about AI development or ethics. The post seems to suggest that Anthropic has done something that breaks established rules or norms, though without accessing the full content, the specific details cannot be definitively confirmed. It's likely a social media discussion about recent developments or perceived transgressions in the AI technology landscape."
https://youtu.be/nnmeGttgmXo?si=JmOF1JxBekDJymmn,Music Performance,"This appears to be a YouTube video featuring a musical performance. Without directly viewing the content, the URL suggests it is a video shared on YouTube with a specific video ID. The inclusion of a timestamp (si parameter) indicates it might be a specific timestamp or sharing link for a music video, concert performance, or musical content. The exact nature of the performance or artist cannot be definitively determined from the URL alone, but it seems to be a video-based musical content piece."
https://x.com/yule_gan/status/1975177775251087436?s=51&t=JsTxSwMxTXa9UP,Social Media Post,"This appears to be a link to a specific post on X (formerly Twitter) by a user with the handle @yule_gan. The URL includes a specific tweet status ID and sharing parameters. Without being able to directly view the content, I can only provide a generic description of a social media link. The post might contain text, images, or other media shared by the user. The sharing parameters (s=51&t=JsTxSwMxTXa9UP) suggest this is a shared or referenced link, potentially meant to be viewed on a mobile device or through a specific sharing mechanism."
https://x.com/daievolutionhub/status/1975169191209554269?s=51&t=JsTxSwM,AI Technology News,"This appears to be a social media post (on X/Twitter) from the account @daievolutionhub discussing artificial intelligence, likely sharing a recent update, insight, or commentary about AI technology trends or developments. Without being able to directly access the specific content, the URL suggests it is a tweet related to AI innovation or insights from a tech-focused account that shares information about digital and AI evolution."
https://x.com/akshay_pachaar/status/1975481986254053517?s=51&t=JsTxSwMx,Social Media Post,"This appears to be a link to a post on X (formerly Twitter) by a user named akshay_pachaar. Without being able to directly view the specific content, the URL represents a social media status update shared on the platform. The string of numbers in the URL suggests it's a unique post identifier. The additional parameters (s=51&t=JsTxSwMx) likely relate to tracking or session information for the specific link. Without direct access to the post's content, I can only provide a generic description based on the URL structure."
https://fr-fr.facebook.com/AssoConnect1/,Nonprofit Management Software,"AssoConnect appears to be a French software platform designed to help associations, nonprofits, and community organizations manage their administrative and operational tasks more efficiently. The Facebook page likely serves as a communication channel for the company to share updates, features, and resources for their digital management solution. The platform typically offers tools for membership management, event organization, financial tracking, communication, and other administrative functions specifically tailored to the needs of nonprofit and associative organizations in France. By providing digital solutions, AssoConnect aims to simplify administrative processes and help associations focus more on their core missions and community impact."
https://x.com/aaditsh/status/1974900178957259012?s=51&t=JsTxSwMxTXa9UPI,Social Media Post,"This appears to be a link to a specific tweet or post on X (formerly Twitter) by a user with the handle 'aaditsh'. The URL contains a unique post identifier and seems to be a standard social media link sharing a specific piece of content. Without directly accessing the content, I cannot specify the exact nature of the post, but it represents a specific social media update shared on the X platform."
https://www.linkedin.com/posts/arnaud-contival-aa947_microsoft-vient-de-publier-lun-des-meilleurs-activity-7379041051212267520-K45b?utm_medium=ios_app&rcm=ACoAAAAEYYQBAG8XEbAwDEP0PvuiZUVQs5HsO8o&utm_source=social_share_send&utm_campaign=share_via,AI/Technology,"This appears to be a LinkedIn post by Arnaud Contival discussing a recent Microsoft publication related to AI or technology. The post seems to be in French and suggests that Microsoft has released something significant, potentially a new AI model, research paper, or technological breakthrough. The full context isn't completely clear from the URL alone, but it seems to be a professional commentary or sharing of a technological development by Microsoft."
https://x.com/mdancho84/status/1972989384732401967?s=51&t=JsTxSwMxTXa9U,Data Science Tweet,"This appears to be a tweet on X (formerly Twitter) by a data science professional (username mdancho84). Given the truncated URL and platform, the tweet likely contains a data science, machine learning, or programming-related insight, visualization, or code snippet. Without being able to view the specific content, the tweet seems to be from a verified or notable account in the data science and analytics community, potentially sharing a technical observation, tutorial, or professional insight related to data analysis, coding, or machine learning techniques."
https://x.com/_avichawla/status/1972912060230164732?s=51&t=JsTxSwMxTXa9,Tech Social Media,"This appears to be a social media post on X (formerly Twitter) from a user named @_avichawla. The URL links to a specific tweet or thread, likely discussing a technology, programming, or digital innovation topic. Without direct access to the content, I can only provide a generic description based on the URL structure. The post may contain insights, commentary, or information related to technology trends, coding, or professional observations. The unique status ID suggests it's a specific, individual post that could be sharing knowledge, an opinion, or a technical observation within the tech community."
"https://www.google.com/maps/search/14+Rue+Chaptal,+92300+Levallois-Per",Location Services,"This is a Google Maps URL for searching a specific street address located in Levallois-Perret, a commune in the western suburbs of Paris, France. The address is 14 Rue Chaptal, within the 92300 postal code area. Google Maps allows users to locate and view geographical information, directions, satellite imagery, and street-level views for this specific address. The URL represents a geospatial search query that would typically display the precise location, surrounding neighborhood details, nearby points of interest, and potential navigation routes to and from this specific address."
https://www.linkedin.com/posts/svonava_your-vector-search-is-broken-i-can-prove-activity-7376651992896806913-h_O5?utm_source=social_share_send&utm_medium=member_desktop_web&rcm=ACoAAAAEYYQBAG8XEbAwDEP0PvuiZUVQs5HsO8o,Vector Search Technology,"This appears to be a LinkedIn post discussing vector search technology and potential performance or implementation issues. The post suggests a critical analysis or demonstration of limitations in current vector search approaches. While the full content isn't visible, the title implies the author has insights or proof about problems with vector search systems, which are commonly used in machine learning, information retrieval, and semantic search applications. The post likely covers technical challenges, performance bottlenecks, or methodological weaknesses in how vector searches are currently designed and executed across various platforms and use cases."
https://www.linkedin.com/posts/paoloperrone_paul-iusztin-just-dropped-the-best-context-activity-7376743488651972608-7sK7?utm_medium=ios_app&rcm=ACoAAAAEYYQBAG8XEbAwDEP0PvuiZUVQs5HsO8o&utm_source=social_share_send&utm_campaign=share_via,Social Media Post,"This appears to be a LinkedIn post shared by Paolo Perrone about a content piece by Paul Iusztin. The URL seems to be a specific social media share link with tracking parameters, likely referencing some professional or industry-related content. Without being able to directly access the content, the link suggests it's a social media post discussing a potentially noteworthy topic or insight shared by Paul Iusztin, potentially related to business, technology, or professional development."
https://meet.google.com/myx-yweb-ruh,Video Conferencing,"This appears to be a Google Meet video conference link, which is a unique URL generated for a specific online meeting or video call session. The alphanumeric code 'myx-yweb-ruh' represents the unique meeting identifier that allows participants to join a particular video conference. Google Meet links typically provide a quick and easy way for multiple people to connect virtually, enabling real-time communication, screen sharing, and collaborative interactions through Google's video conferencing platform. Users can join these meetings by clicking the link or entering the code into the Google Meet interface, which works across various devices including computers, smartphones, and tablets."
https://x.com/sumanth_077/status/1970481805288436178?s=51&t=JsTxSwMxTXa,Social Media Post,"This is a link to a specific tweet (X post) by user @sumanth_077, shared on the social media platform X (formerly Twitter). The URL includes a unique status/tweet identifier and appears to be a shared link with additional tracking parameters. Without being able to directly view the content of the tweet, the specific details of the post cannot be determined from the URL alone."
https://x.com/aaditsh/status/1969552189657137177?s=51&t=JsTxSwMxTXa9UPI,Social Media Post,"This appears to be a social media link on X (formerly Twitter) to a specific post by a user named aaditsh. Without directly accessing the content, it seems to be a tweet shared with a unique status ID. The URL includes additional tracking parameters (s=51 and t=JsTxSwMxTXa9UPI) which are typically used for tracking engagement or source of the link. The specific content of the tweet cannot be determined from the URL alone and would require opening the link to view the actual post."
https://x.com/intuitmachine/status/1969723501675164157?s=51&t=JsTxSwMxT,Social Media Post,"This is a link to a specific post on X (formerly Twitter) by a user with the handle @intuitmachine. The URL points to a specific tweet identified by its unique status ID. Without being able to directly view the content, I can only provide a generic description of what this represents - a social media communication shared on the X platform, which could potentially contain text, images, links, or other media. The additional parameters 's=51&t=' suggest this might be a shared or referenced link, possibly from a third-party source or sharing mechanism."
https://x.com/neatprompts/status/1969462571360272681?s=51&t=JsTxSwMxTXa,AI Prompt Sharing,"This appears to be a social media post on X (formerly Twitter) from the account @neatprompts, which likely shares interesting or useful AI prompts. The specific post references a unique tweet ID and seems to be part of a platform or account dedicated to curating and sharing effective AI conversation starters or prompt engineering techniques. Without being able to view the exact content, the link suggests it's related to AI communication strategies, potentially offering insights or examples of how to effectively interact with AI language models to generate desired responses."
https://developers.googleblog.com/en/introducing-gemini-2-5-flash-image/?utm_source=email&utm_medium=newsletter&utm_campaign=dev_program_september,AI/Machine Learning,"This Google Developers Blog post introduces Gemini 2.5 Flash, a new AI model focused on image and multimodal capabilities. The article likely discusses the model's technical specifications, performance improvements, and potential use cases for developers and researchers. Gemini Flash appears to be a lightweight, efficient version of Google's AI technology, designed to provide fast and accurate image processing and understanding. The post may cover details about the model's architecture, its integration with existing Google developer tools, and how developers can leverage this technology in their applications. The URL suggests this is part of Google's ongoing efforts to advance AI capabilities and provide cutting-edge machine learning solutions to the developer community."
https://t.co/I6xCRb9JiZ,,
https://x.com/ernestosoftware/status/1967626661517779182?s=51&t=JsTxSwM,Social Media Post,"This appears to be a link to a post on X (formerly Twitter) from a user named 'ernestosoftware'. Without direct access to view the specific content, the URL suggests it's a social media update or tweet. The long string of numbers in the status section indicates a unique post identifier. The additional parameters (s=51&t=JsTxSwM) are likely tracking or authentication tokens used by the platform for link sharing or analytics purposes."
https://www.linkedin.com/in/nivethan-sivarajalingam,Professional Profile,"This is a LinkedIn profile for Nivethan Sivarajalingam, which appears to be a personal professional networking page. LinkedIn profiles typically showcase an individual's professional background, including work experience, education, skills, and professional achievements. While the specific details of Nivethan's professional journey are not visible without accessing the profile, the URL suggests this is a standard personal profile where an individual presents their professional identity, career history, and potential networking opportunities. Such profiles are commonly used by professionals to connect with colleagues, showcase their expertise, and explore career opportunities."
https://www.linkedin.com/posts/rolfmouchelblaisot_cette-architecture-divise-par-5-le-temps-activity-7369308288276017152-jYrL?utm_medium=ios_app&rcm=ACoAAAAEYYQBAG8XEbAwDEP0PvuiZUVQs5HsO8o&utm_source=social_share_send&utm_campaign=share_via,Architecture/Design,"This appears to be a LinkedIn post about an innovative architectural design that significantly reduces construction time. The post seems to highlight a new architectural approach or technique that potentially cuts down project duration by a factor of five. While the specific details are not fully visible in the URL, it suggests a breakthrough in construction methodology that could improve efficiency in building design and project management. The post is shared by Rolf Mouche Blaisot, likely an architect or professional in the construction industry, and discusses an architectural solution that promises substantial time savings in the building process."
https://x.com/neatprompts/status/1965446112602722458?s=51&t=JsTxSwMxTXa,AI Prompt Engineering,"This appears to be a social media post on X (formerly Twitter) from the account @neatprompts, likely sharing an interesting or innovative AI prompt. The specific content of the prompt is not visible from the URL alone, but the account seems focused on sharing creative or useful prompts for artificial intelligence tools like ChatGPT. The post includes a unique status ID and appears to be a shared or recommended tweet about AI prompt techniques or examples."
https://www.linkedin.com/posts/loverdeolivier_microsoft-vient-de-publier-un-cours-pratique-activity-7368896788608471041-4Gbp?utm_medium=ios_app&rcm=ACoAAAAEYYQBAG8XEbAwDEP0PvuiZUVQs5HsO8o&utm_source=social_share_send&utm_campaign=share_via,Tech Education,"This appears to be a LinkedIn post about a practical Microsoft course, likely related to technology or software development. The post is in French, suggesting it's discussing a new educational resource or training program from Microsoft. The URL indicates it's a shared social media post about a course or learning opportunity, potentially aimed at professionals or students interested in Microsoft technologies. The specific details of the course are not fully visible from the provided link, but it seems to be a sharing of an educational content announcement."